{
  "apache_patent_grant_acknowledged": true,
  "bundle_sha256": "15dd35b871baa4bcd580ce90c08c49b9d174431db7d1eed22ca3b089d60a2924",
  "clearance_receipt_id": "ccr-fixture-fixture-index-valid-01",
  "clearance_status": "CLEARED",
  "commercial_impact": "NONE",
  "completed_at": "2026-10-03T00:00:00Z",
  "dimensions": {
    "commercial_impact": {
      "basis": "Synthetic fixture.",
      "owner": "commons-maintainers",
      "status": "PASS"
    },
    "dependency_license": {
      "basis": "Synthetic fixture.",
      "owner": "commons-maintainers",
      "status": "PASS"
    },
    "originating_technical": {
      "basis": "Synthetic fixture.",
      "owner": "commons-maintainers",
      "status": "PASS"
    },
    "provenance": {
      "basis": "Synthetic fixture.",
      "owner": "commons-maintainers",
      "status": "PASS"
    },
    "public_packaging": {
      "basis": "Synthetic fixture.",
      "owner": "commons-maintainers",
      "status": "PASS"
    },
    "security": {
      "basis": "Synthetic fixture.",
      "owner": "commons-maintainers",
      "status": "PASS"
    }
  },
  "package_id": "fixture-index-valid-01",
  "private_clearance_receipt": {
    "status": "NOT_APPLICABLE_COMMONS_NATIVE"
  },
  "public_release_id": "cpr-fixture-index-valid-01-0.1.0",
  "release_class": "P3_PUBLIC_RELEASE_APPROVED",
  "schema_version": "commons.public-clearance-receipt.v0.1",
  "scope_statement": "Synthetic fixture bundle only.",
  "source_disclosure_level": "COMMONS_NATIVE",
  "version": "0.1.0"
}
